{
  "manifestVersion": "1.0",
  "id": "generated_test_avatar_v1",
  "name": "Generated test avatar (unapproved)",
  "canvas": { "width": 1024, "height": 1536 },
  "assets": [
    {
      "id": "eye_whites",
      "type": "image",
      "path": "layers/eye-whites.png"
    },
    { "id": "pupils", "type": "image", "path": "layers/pupils.png" },
    {
      "id": "portrait_eye_hole_base",
      "type": "image",
      "path": "layers/portrait-eye-hole-base.png"
    },
    { "id": "eyelids", "type": "image", "path": "layers/eyelids.png" }
  ],
  "parameters": [
    { "id": "gazeX", "min": -1, "max": 1, "default": 0 },
    { "id": "gazeY", "min": -1, "max": 1, "default": 0 },
    { "id": "mouthOpen", "min": 0, "max": 1, "default": 0 },
    { "id": "blink", "min": 0, "max": 1, "default": 0 },
    { "id": "browLift", "min": -1, "max": 1, "default": 0 },
    { "id": "headTilt", "min": -1, "max": 1, "default": 0 },
    { "id": "bodyLean", "min": -1, "max": 1, "default": 0 }
  ],
  "capabilities": {
    "expression": {
      "content": ["neutral", "happy", "sad", "angry", "surprised", "thinking"]
    },
    "motion": { "content": ["idle", "nod", "wave", "explain", "shrug"] },
    "gaze": true,
    "blink": true,
    "mouthOpen": true,
    "reset": true
  }
}
